325/2021,Liga Uberabense Acadêmica de Oncologia,GUILHERME FREIRE ANGOTTI CARRARA,ICS,Liga Acadêmica (Programa),Saúde,23/11/2021,23/11/2022,26/10/2021,17/11/2021,SIEX - Fluxo Contínuo,Não Tem Recurso Financeiro,----
326/2021 (Nº de registro alterado - ver planilha de 2022),Anatomia descritiva e funcional do sistema articular,LEONARDO AUGUSTO LOMBARDI,ICBN,Curso,Saúde,17/01/2022,28/01/2022,22/10/2021,17/11/2021,SIEX - Fluxo Contínuo,Não Tem Recurso Financeiro,----
327/2021, Mapa corporal: conceitos e experimentações introdutórias ,MARINA LEANDRINI DE OLIVEIRA,ICS,Evento,Educação,16/11/2021,18/11/2021,29/10/2021,18/11/2021,SIEX - Fluxo Contínuo,Não Tem Recurso Financeiro,----
328/2021,Webinar: Desafios na atenção ao prematuro e sua família,MARIANA TORREGLOSA RUIZ,ICS,Evento,Saúde,01/12/2021,15/12/2021,17/11/2021,18/11/2021,SIEX - Fluxo Contínuo,Não Tem Recurso Financeiro,----
329/2021,"Prospecção de oportunidades de Pesquisa, Desenvolvimento e Inovação entre a UFTM e empresas",DOUGLAS MOURA MIRANDA,Núcleo de Inovação Tecnológica,Projeto,Tecnologia e Produção,25/11/2021,24/11/2023,8/11/2021,19/11/2021,SIEX - Fluxo Contínuo,Não Tem Recurso Financeiro,----
330/2021,III Encontro de Geriatria e Gerontologia do Triângulo Mineiro,VITORIA HELENA MACIEL COELHO,ICS,Evento,Saúde,17/11/2021,18/11/2021,03/11/2021,23/11/2021,SIEX - Fluxo Contínuo,Não Tem Recurso Financeiro,----
331/2021,CONCURSO DE REDAÇÃO DO PROJETO UBERABA 200 ANOS: A UFTM TAMBÉM FAZ PARTE DESSA HISTÓRIA,PAULA CUSINATO,DDCult/PROEXT,Evento,Cultura,20/07/2021,31/07/2021,06/07/2021,23/11/2021,SIEX - Fluxo Contínuo,Não Tem Recurso Financeiro,----
332/2021,II Simpósio da Liga Universitária da Amamentação,LUCIANO BORGES SANTIAGO,ICS,Evento,Educação,07/12/2021,07/12/2021,18/11/2021,24/11/2021,SIEX - Fluxo Contínuo,Não Tem Recurso Financeiro,----
333/2021 (Nº de registro alterado - ver planilha de 2022),VIII SIMPÓSIO INTERNACIONAL DE ESTUDOS LINGUÍSTICOS E LITERÁRIOS,ANA AMELIA CALAZANS DA ROSA,IELACHS,Evento,Educação,03/05/2022,06/05/2022,18/11/2021,24/11/2021,SIEX - Fluxo Contínuo,FUNEPU,"23.850,73"
334/2021,"IV Colóquio Internacional sobre Escrita, Variação e Interculturalidade: estudos e pesquisas (CIEVLI) e III Roda de Conversa sobre Cooperação Acadêmica Brasil-África",JULIANA BERTUCCI BARBOSA,IELACHS,Evento,Educação,29/11/2021,01/12/2021,9/11/2021,25/11/2021,SIEX - Fluxo Contínuo,Não Tem Recurso Financeiro,----
335/2021 (Nº de registro alterado - ver planilha de 2022),Doação de Sangue - compromisso social,SHEILA SOARES SILVA,ICS,Projeto,Saúde,03/01/2022,31/10/2022,23/11/2021,03/12/2021,SIEX - Fluxo Contínuo,Não Tem Recurso Financeiro,----
336/2021,III simpósio e curso introdutório à Liga Acadêmica de Patologia Geral e Nefropatologia ,JULIANA REIS MACHADO E SILVA,PROPPG,Evento,Saúde,13/12/2021,13/12/2021,2/12/2021,06/12/2021,SIEX - Fluxo Contínuo,Não Tem Recurso Financeiro,----
337/2021 (Nº de registro alterado - ver planilha de 2022),"Guia Digital Ilustrado das Angiospermas do Bairro Rural de Peirópolis, Uberaba, MG",POLYANA NORONHA SOARES,ICENE,Projeto,Educação,06/01/2022,06/07/2022,26/11/2021,06/12/2021,SIEX - Fluxo Contínuo,Não Tem Recurso Financeiro,----
338/2021,V Simpósio da Liga Acadêmica de Saúde Esportiva (LASE) e V Curso Introdutório à LASE,DANIEL FERREIRA MOREIRA LOBATO,PROPPG,Evento,Saúde,10/12/2021,10/12/2021,26/11/2021,06/12/2021,SIEX - Fluxo Contínuo,Não Tem Recurso Financeiro,----
339/2021,"Curso de Capacitação da Rede de Atendimento  a Criança e do Adolescente - Uberaba, MG",AILTON DE SOUZA ARAGAO,ICS,Curso,Direitos Humanos e Justiça,21/12/2021,29/12/2021,23/11/2021,09/12/2021,SIEX - Fluxo Contínuo,Não Tem Recurso Financeiro,----
340/2021,Liga de Análises Clínicas (LAC),ALEXANDRE DE PAULA ROGERIO,ICS,Programa,Educação,06/12/2021,16/12/2022,21/10/2021,13/12/2021,SIEX - Fluxo Contínuo,Não Tem Recurso Financeiro,----
341/2021,II Jornada do Setembro Amarelo ,TOMAS ROTELLI DE OLIVEIRA FERREIRA,ICS,Evento,Educação,20/9/2021,30/09/2021,9/12/2021,23/12/2021,SIEX - Fluxo Contínuo,Não Tem Recurso Financeiro,----
342/2021,Liga Acadêmica de Psicobiologia - L-Psicobio,Sionaldo Eduardo Ferreira,ICBN,Liga Acadêmica (Programa),Saúde,01/03/2021,01/12/2021,19/12/2020,12/01/2021,SIGProj - Edital PIBEX nº  07/2020 - sem bolsa,PROEXT-UFTM,----
,,,,,,,,,,,,
Atualizada em 22/03/2022,,,,,,,,,,,,