216/2021,IX SEAMB - Semana Acadêmica da Engenharia Ambiental - 2ª Edição Online,DIEGO ANDRADE LEMOS,ICTE,Evento,Meio ambiente,14/07/2021,15/10/2021,30/06/2021,08/07/2021,SIEX - Fluxo Contínuo,Não Tem Recurso Financeiro,----
217/2021,Curso de Inverno: Velhice não é doença ,SURAYA GOMES NOVAIS SHIMANO,ICS,Curso,Saúde,04/08/2021,06/08/2021,03/07/2021,09/07/2021,SIEX - Fluxo Contínuo,Não Tem Recurso Financeiro,----
218/2021,Programa FloRir: Vivências em mindful eating para estudantes universitários,FERNANDA RODRIGUES DE OLIVEIRA PENAFORTE,ICS,Programa,Saúde,02/08/2021,01/08/2022,28/06/2021,09/07/2021,SIEX - Fluxo Contínuo,Não Tem Recurso Financeiro,----
219/2021,Semana da Biologia- IV SEMBIO,RADAI CLERIA FELIPE GONCALVES,CAMPUS UNIVERSITÁRIO DE ITURAMA,Evento ,Educação,17/08/2021,20/08/2021,07/07/2021,09/07/2021,SIEX - Fluxo Contínuo,Não Tem Recurso Financeiro,----
220/2021,Fabricação de álcool gel e outros antissépticos na prevenção da COVID-19,LUCAS FERREIRA DE PAULA,CAMPUS UNIVERSITÁRIO DE ITURAMA,Projeto,Saúde,28/09/2021,28/09/2022,24/05/2021,13/07/2021,SIEX - Fluxo Contínuo,Não Tem Recurso Financeiro,----
221/2021,English for all,SURAYA GOMES NOVAIS SHIMANO,ICS,Projeto,Educação,08/07/2021,20/12/2021,10/06/2021,13/07/2021,SIEX - Fluxo Contínuo,Não Tem Recurso Financeiro,----
222/2021,NHE´É PORÃ - PALAVRAS SAGRADAS: Saberes originário para educadores ,JONAS BACH JUNIOR,IELACHS,Curso,Educação,02/08/2021,30/11/2021,01/07/2021,13/07/2021,SIEX - Fluxo Contínuo,Não Tem Recurso Financeiro,----
223/2021,I Simpósio NIERS: Descomplicando as Revisões Sistemáticas ,LEONARDO AUGUSTO LOMBARDI,ICBN,Evento,Saúde,11/08/2021,11/08/2021,04/07/2021,14/07/2021,SIEX - Fluxo Contínuo,Não Tem Recurso Financeiro,----
224/2021,Criação de conteúdo digital para o Instagram ,OZIRIS BORGES FILHO,IELACHS,Projeto,Educação,13/07/2021,09/12/2021,14/06/2021,14/07/2021,SIEX - Fluxo Contínuo,Não Tem Recurso Financeiro,----
225/2021,Fundamentos de Justiça Restaurativa na Comunidade,CRISTIANE PAULIN SIMON,ICS,Curso,Direitos Humanos e Justiça,02/08/2021,23/11/2021,05/07/2021,15/07/2021,SIEX - Fluxo Contínuo,Não Tem Recurso Financeiro,----
226/2021,Liga Acadêmica de Neonatologia 2021,VALERIA CARDOSO ALVES CUNALI,ICS,Liga Acadêmica (Programa),Saúde,17/08/2021,17/08/2022,15/07/2021,16/07/2021,SIEX - Fluxo Contínuo,Não Tem Recurso Financeiro,----
227/2021,Liga Acadêmica de Pediatria 2021,VALERIA CARDOSO ALVES CUNALI,ICS,Liga Acadêmica (Programa),Saúde,01/08/2021,01/08/2022,23/06/2021,16/07/2021,SIEX - Fluxo Contínuo,Não Tem Recurso Financeiro,----
228/2021,Agosto Lilás e Universidade: olhares sobre a violência contra a mulher,CRISTIANE PAULIN SIMON,ICS,Evento,Direitos Humanos e Justiça,12/08/2021,26/08/2021,14/07/2021,19/07/2021,SIEX - Fluxo Contínuo,Não Tem Recurso Financeiro,----
229/2021,Tecnologias Digitais na Educação,JAMES ROGADO,CAMPUS UNIVERSITÁRIO DE ITURAMA,Curso,Educação,25/08/2021,25/08/2021,15/07/2021,20/07/2021,SIEX - Fluxo Contínuo,Não Tem Recurso Financeiro,----
230/2021,"Mostra de Pesquisa, Ensino e Extensão do IELACHS",JANAINA FRANCISCA DE SOUZA CAMPOS VINHA,IELACHS,Evento,Educação,23/08/2021,26/08/2021,19/07/2021,21/07/2021,SIEX - Fluxo Contínuo,Não Tem Recurso Financeiro,----
231/2021,Trem das Onze,OZIRIS BORGES FILHO,IELACHS,Evento,Educação,21/08/2021,17/12/2021,20/07/2021,22/07/2021,SIEX - Fluxo Contínuo,Não Tem Recurso Financeiro,----
232/2021,PT-Day 2021 – Dia Mundial da Fisioterapia,SURAYA GOMES NOVAIS SHIMANO,ICS,Evento,Saúde,03/09/2021,03/09/2021,20/07/2021,22/07/2021,SIEX - Fluxo Contínuo,Não Tem Recurso Financeiro,----
233/2021,Discutindo sobre morte: intervenção grupal com acadêmicos,EDUARDO SOUSA GOTTI,IELACHS,Curso,Saúde,02/08/2021,10/09/2021,30/06/2021,22/07/2021,SIEX - Fluxo Contínuo,Não Tem Recurso Financeiro,----
234/2021,"Vivenciando a Semana Nacional e Municipal de Ciência, Tecnologia e Inovação ",LISLEI JORGE PATRIZZI MARTINS,ICS,Projeto,Educação,10/08/2021,17/12/2021,13/07/2021,27/07/2021,SIEX - Fluxo Contínuo,Não Tem Recurso Financeiro,----
235/2021,Ética e desenvolvimento sustentável: dialogando sobre responsabilidade e reciprocidade com futuros líderes comunitários,FERNANDA BORGES DE ANDRADE,IELACHS,Projeto,Direitos Humanos e Justiça,14/04/2021,13/11/2021,09/07/2021,27/07/2021,SIEX - Fluxo Contínuo,Não Tem Recurso Financeiro,----
236/2021,X Semana Universitária de Engenharia Química ,KASSIA GRACIELE DOS SANTOS,ICTE,Evento,Tecnologia e Produção,13/09/2021,17/09/2021,22/07/2021,27/07/2021,SIEX - Fluxo Contínuo,Não Tem Recurso Financeiro,----
237/2021,I CONGRESSO MULTIPROFISSIONAL DE ATENÇÃO HOSPITALAR (I COMAH),GILBERTO DE ARAUJO PEREIRA,ICS,Evento,Saúde,12/08/2021,15/08/2021,24/06/2021,28/07/2021,SIEX - Fluxo Contínuo,FUNEPU,"R$6000,00"
238/2021,Núcleo Rondon na Universidade Federal do Triângulo Mineiro    ,BRUNA VIEIRA CABRAL,ICTE,Programa,Meio Ambiente,01/07/2021,01/07/2022,02/07/2021,29/07/2021,SIEX - Fluxo Contínuo,PROEXT - UFTM (1 Bolsa de Extensão - 06 meses/2021 - julho a dezembro/2021 - PS DDEX nº 07/2021),"R$ 2.400,00"
239/2021,"Iº Seminário Studia Brasiliensia ""Brasileir@s, quem somos?""",LUCIO ALVARO MARQUES,IELACHS,Evento,Educação,30/09/2021,02/10/2021,16/07/2021,29/07/2021,SIEX - Fluxo Contínuo,Não Tem Recurso Financeiro,----
240/2021,Encontro comemorativo dos 15 anos do Curso de Fisioterapia da UFTM,KARINA PEREIRA,ICS,Evento,Saúde,24/08/2021,25/08/2021,25/07/2021,30/07/2021,SIEX - Fluxo Contínuo,Não Tem Recurso Financeiro,----
241/2021,1º Simpósio da Liga das Artes Maria Faceira - UFTM:  Um Bando das Artes e pelas Artes!,CLAUDIA FRANCO MONTEIRO,ICS,Evento,Cultura,19/08/2021,20/08/2021,20/07/2021,03/08/2021,SIEX - Fluxo Contínuo,Não Tem Recurso Financeiro,----
242/2021,Revista PET Brasil,OZIRIS BORGES FILHO,IELACHS,Projeto,Educação,09/08/2021,31/12/2021,10/07/2021,04/08/2021,SIEX - Fluxo Contínuo,Não Tem Recurso Financeiro,----
243/2021,Utilização da ferramenta de mídia social Instagram na construção e divulgação do conhecimento científico em saúde coletiva e do idoso,DARLENE MARA DOS SANTOS TAVARES,ICS,Projeto,Saúde,23/08/2021,30/12/2021,20/07/2021,04/08/2021,SIEX - Fluxo Contínuo,Não Tem Recurso Financeiro,----
244/2021,II SIMPÓSIO E CURSO INTRODUTÓRIO À LIGA INTERDISCIPLINAR AQUÁTICA,SURAYA GOMES NOVAIS SHIMANO,ICS,Evento,Saúde,19/08/2021,19/08/2021,30/07/2021,05/08/2021,SIEX - Fluxo Contínuo,Não Tem Recurso Financeiro,----
245/2021,Acolhimento e orientação para pais e cuidadores de crianças com síndrome de Down,KARINA PEREIRA,ICS,Projeto,Saúde,23/08/2021,10/12/2021,23/07/2021,09/08/2021,SIEX - Fluxo Contínuo,Não Tem Recurso Financeiro,----
246/2021,Liga Acadêmica de Trissomia do 21,MAIRA FERREIRA DO AMARAL,ICS,Liga Acadêmica (Programa),Saúde,01/09/2021,11/06/2022,03/08/2021,09/08/2021,SIEX - Fluxo Contínuo,Não Tem Recurso Financeiro,----
247/2021,GRUPO DE ESTUDO EM SAÚDE DAS POPULAÇÕES (GRUESP): WHATSAPP® COMO RECURSO PARA A EDUCAÇÃO EM SAÚDE,ISABEL APARECIDA PORCATTI DE WALSH,ICS,Projeto,Educação,23/08/2021,27/07/2022,21/07/2021,09/08/2021,SIEX - Fluxo Contínuo,Não Tem Recurso Financeiro,----
248/2021,I SIMPÓSIO INTRODUTÓRIO DA LIGA ACADÊMICA DE PSICOLOGIA DO ESPORTE,ALINE DESSUPOIO CHAVES,ICS,Evento,Saúde,09/09/2021,10/09/2021,28/07/2021,09/08/2021,SIEX - Fluxo Contínuo,Não Tem Recurso Financeiro,----
249/2021,LIGA ACADÊMICA DE NEUROCIRURGIA DA UFTM,ROBERTO ALEXANDRE DEZENA,ICS,Liga Acadêmica (Programa),Saúde,15/08/2021,15/08/2022,13/07/2021,09/08/2021,SIEX - Fluxo Contínuo,Não Tem Recurso Financeiro,----
250/2021,VI Fórum do Instituto de Ciências da Saúde: Estratégias para cuidar da saúde física e mental.,ANDREA RUZZI PEREIRA,ICS,Evento,Saúde,15/09/2021,15/09/2021,05/08/2021,10/08/2021,SIEX - Fluxo Contínuo,Não Tem Recurso Financeiro,----
251/2021,ÁGAPE: Atendimento Generalista a Populações Especiais,SURAYA GOMES NOVAIS SHIMANO,ICS,Programa,Direitos Humanos e Justiça,31/08/2021,23/12/2022,03/08/2021,13/08/2021,SIEX - Fluxo Contínuo,Não Tem Recurso Financeiro,----
252/2021,XI Curso Introdutório à Liga Acadêmica de Neurociências da UFTM,PATRICIA HELENA ZANIER GOMES,ICBN,Evento,Saúde,26/08/2021,26/08/2021,09/08/2021,16/08/2021,SIEX - Fluxo Contínuo,Não Tem Recurso Financeiro,----
253/2021,Ação popular solidária e distribuição de EPis no enfrentamento à Covid-19,MARCIO DE QUEIROZ MURAD,CENTRO DE EDUCAÇÃO PROFISSIONAL,Projeto,Saúde,01/05/2021,31/12/2021,03/08/2021,18/08/2021,SIEX - Fluxo Contínuo,FUNEPU,"R$ 9.800,00"
254/2021,III Curso de Atualização em Pesquisa Translacional: do experimental à clínica,JULIANA REIS MACHADO E SILVA,ICBN,Curso,Saúde,14/09/2021,16/09/2021,05/08/2021,19/08/2021,SIEX - Fluxo Contínuo,Não Tem Recurso Financeiro,----
255/2021,Você na UFTM,REGINA LIMA ANDRADE GONCALLO,PROENS,Projeto,Comunicação,12/09/2021,30/04/2022,12/08/2021,20/08/2021,SIEX - Fluxo Contínuo,Não Tem Recurso Financeiro,----
256/2021,VI Simpósio e Curso Introdutório de Cuidados Paliativos da LACP/UFTM ,LEILA APARECIDA KAUCHAKJE PEDROSA,ICS,Evento,Saúde,21/08/2021,21/08/2021,11/08/2021,20/08/2021,SIEX - Fluxo Contínuo,Não Tem Recurso Financeiro,----
257/2021,2º Ciclo de Palestras do Núcleo de Estudos e Pesquisas Socioambientais (NEPS),JOB ANTONIO GARCIA RIBEIRO,CAMPUS UNIVERSITÁRIO DE ITURAMA,Evento,Meio Ambiente,13/09/2021,13/12/2021,09/08/2021,23/08/2021,SIEX - Fluxo Contínuo,Não Tem Recurso Financeiro,----
258/2021,Liga Acadêmica de Neurociências da UFTM,PATRICIA HELENA ZANIER GOMES,ICBN,Liga Acadêmica (Programa),Saúde,16/09/2021,15/09/2022,17/08/2021,24/08/2021,SIEX - Fluxo Contínuo,Não Tem Recurso Financeiro,----
259/2021,LIGA ACADÊMICA DE GASTROENTEROLOGIA E HEPATOLOGIA DA UFTM (LAGH- UFTM),GEISA PEREZ MEDINA GOMIDE,ICS,Liga Acadêmica (Programa),Saúde,01/10/2021,01/10/2022,25/08/2021,26/08/2021,SIEX - Fluxo Contínuo,Não Tem Recurso Financeiro,----
260/2021,Formação inicial para a vida acadêmica,WASHINGTON ABADIO DA SILVA,PROACE,Curso,Educação,21/09/2021,22/11/2021,24/08/2021,26/08/2021,SIEX - Fluxo Contínuo,Não Tem Recurso Financeiro,----
261/2021,VII Jornada Universitária em Defesa da Reforma Agrária e Indígena - JURAI,LEANDRA DOMINGUES SILVERIO,IELACHS,Evento,Direitos Humanos e Justiça,13/09/2021,30/09/2021,18/08/2021,27/08/2021,SIEX - Fluxo Contínuo,Não Tem Recurso Financeiro,----
262/2021,I Simpósio da Liga Acadêmica de Trissomia 21,FRANCISLENE GLORIA DE FREITAS REIS,ICBN,Evento,Saúde,02/09/2021,02/09/2021,19/08/2021,27/08/2021,SIEX - Fluxo Contínuo,Não Tem Recurso Financeiro,----
263/2021,"Curso de Eletrocardiografia ""Professor Sylvio Pontes Prata"" 2021",FERNANDO DE MARTINO,ICS,Curso,Saúde,29/09/2021,24/11/2021,24/08/2021,30/08/2021,SIEX - Fluxo Contínuo,Não Tem Recurso Financeiro,----
264/2021,"III Simpósio e Curso Introdutório à Liga Acadêmica de Psicologia e Audiovisual: ""Espelho, espelho meu: O papel das mídias sociais na autopercepção dos sujeitos.""",TALES VILELA SANTEIRO,IELACHS,Evento,Cultura,02/09/2021,02/09/2021,13/08/2021,30/08/2021,SIEX - Fluxo Contínuo,Não Tem Recurso Financeiro,----
265/2021,IX SEGEP - Semana de Graduação em Engenharia de Produção,RENATO LUVIZOTO RODRIGUES DE SOUZA,ICTE,Evento,Tecnologia e Produção,09/09/2021,11/11/2021,17/08/2021,30/08/2021,SIEX - Fluxo Contínuo,Não Tem Recurso Financeiro,----
266/2021,PROGRAMA DE EXTENSÃO ABAIXO DA PELE (Inovações para o ensino de Anatomia Humana e suas potencialidades),RENATA PEREIRA ALVES BALVEDI,CAMPUS UNIVERSITÁRIO DE ITURAMA,Programa,Saúde,23/09/2021,30/09/2022,26/08/2021,01/09/2021,SIEX - Fluxo Contínuo,Não Tem Recurso Financeiro,----
267/2021,1° Simpósio Introdutório à Liga Acadêmica de Psicologia do Desenvolvimento da Criança e do Adolescente - O brincar na Infância e na Adolescência,CONCEICAO APARECIDA SERRALHA,IELACHS,Evento,Saúde,08/09/2021,08/09/2021,23/08/2021,01/09/2021,SIEX - Fluxo Contínuo,Não Tem Recurso Financeiro,----
268/2021,Cuidados com a Ventilação não Invasiva,FABIANA JORGE BUENO GALDINO BARSAM,ICS,Curso,Saúde,03/09/2021,01/11/2021,04/08/2021,03/09/2021,SIEX - Fluxo Contínuo,Não Tem Recurso Financeiro,----
269/2021,SAÚDE SEXUAL E SEXUALIDADE DO IDOSO: DEMANDAS DA ATENÇÃO PRIMÁRIA,ALVARO DA SILVA SANTOS,ICS,Projeto,Saúde,01/09/2021,31/08/2022,19/08/2021,07/09/2021,SIEX - Edital 05/2021 - com bolsa,PROEXT - UFTM / FUNEPU,"R$ 3.600,00"
270/2021,Aprimorando os Conhecimentos ,PATRICIA HELENA ZANIER GOMES,ICBN,Projeto,Educação,01/09/2021,31/08/2022,19/08/2021,07/09/2021,SIEX - Edital 05/2021 - com bolsa,PROEXT - UFTM / FUNEPU,"R$ 3.600,00"
271/2021,Cápsula de Histórias,SABRINA MARTINS BARROSO,IELACHS,Projeto,Cultura,01/09/2021,31/08/2022,19/08/2021,07/09/2021,SIEX - Edital 05/2021 - com bolsa,PROEXT - UFTM / FUNEPU,"R$ 3.600,00"
272/2021,Rota das trilhas: Desenvolvimento social e econômico por meio do turismo,ARIANE FERNANDES DA CONCEICAO,CAMPUS UNIVERSITÁRIO DE ITURAMA,Projeto,Cultura,01/09/2021,31/08/2022,18/08/2021,07/09/2021,SIEX - Edital 05/2021 - com bolsa,PROEXT - UFTM / FUNEPU,"R$ 3.600,00"
273/2021,Meditação: Ciência para Mudança de Hábito,MARINA CASTRO DE ALMEIDA,IELACHS,Projeto,Saúde,01/09/2021,31/08/2022,19/08/2021,07/09/2021,SIEX - Edital 05/2021 - com bolsa,PROEXT - UFTM / FUNEPU,"R$ 3.600,00"
274/2021,III Simpósio da Liga Acadêmica de Pneumologia e Prevenção ao Tabagismo,MARIA HELENA DE CASTRO SILVA,ICS,Evento,Saúde,02/09/2021,02/09/2021,19/08/2021,08/09/2021,SIEX - Fluxo Contínuo,Não Tem Recurso Financeiro,----
275/2021,III SIMPÓSIO INTRODUTÓRIO DA LIGA ACADÊMICA DE AVALIAÇÃO FÍSICA – UFTM,JEFFER EIDI SASAKI,DEPARTAMENTO DE DESENVOLVIMENTO DA PÓS-GRADUAÇÃO,Evento,Saúde,21/09/2021,28/09/2021,03/09/2021,08/09/2021,SIEX - Fluxo Contínuo,Não Tem Recurso Financeiro,----
276/2021,Liga Acadêmica de Pneumologia e Prevenção ao Tabagismo,MARIA HELENA DE CASTRO SILVA,ICS,Liga Acadêmica (Programa),Educação,23/09/2021,22/09/2022,26/08/2021,10/09/2021,SIEX - Fluxo Contínuo,Não Tem Recurso Financeiro,----
277/2021,"Análise estatística: noções básicas de construção de banco de dados, análises descritiva e inferencial",LEILA APARECIDA KAUCHAKJE PEDROSA,ICS,Curso,Educação,18/10/2021,19/10/2021,03/09/2021,13/09/2021,SIEX - Fluxo Contínuo,Não Tem Recurso Financeiro,----
278/2021,Aula Aberta 3 – comunicação entre pais e filhos: uma visão psicossocial,LUCIANA MARIA DA SILVA,ICS,Evento,Direitos Humanos e Justiça,20/09/2021,27/09/2021,06/09/2021,14/09/2021,SIEX - Fluxo Contínuo,Não Tem Recurso Financeiro,----
279/2021,"V SEMANA DE SERVIÇO SOCIAL :  Serviço Social, trabalho contemporâneo e pandemia",DANIELLA DE SOUZA SANTOS NESPOLI,IELACHS,Evento,Direitos Humanos e Justiça,29/09/2021,21/10/2021,09/09/2021,14/09/2021,SIEX - Fluxo Contínuo,Não Tem Recurso Financeiro,----
280/2021,II Colóquio sobre Intervenção Precoce para Lactentes: Responsabilidade compartilhada com a família,ELAINE LEONEZI GUIMARAES,ICS,Evento,Saúde,25/09/2021,25/09/2021,15/09/2021,15/09/2021,SIEX - Fluxo Contínuo,Não Tem Recurso Financeiro,----
281/2021,Cuidado integral em saúde às pessoas atendidas no ambulatório de Doenças Infecciosas e Parasitárias do HC- UFTM: Atuação da Residência Multiprofissional em Saúde do Adulto,PATRICIA PAIVA CARVALHO,Hospital de Clínicas - HC,Projeto,Saúde,14/07/2021,13/03/2022,16/06/2021,15/09/2021,SIEX - Fluxo Contínuo,Não Tem Recurso Financeiro,----
282/2021,XIII Simpósio Introdutório à Liga Uberabense Acadêmica de Oncologia,GUILHERME FREIRE ANGOTTI CARRARA,ICS,Evento,Saúde,28/09/2021,28/09/2021,13/09/2021,15/09/2021,SIEX - Fluxo Contínuo,Não Tem Recurso Financeiro,----
283/2021,Biodiversidade de insetos polinizadores e provedores de serviços ecossistêmicos de Uberaba,RHAINER GUILLERMO NASCIMENTO FERREIRA,ICENE,Projeto,Meio Ambiente,19/09/2021,12/09/2022,30/08/2021,16/09/2021,SIEX - Edital 09/2021 - com bolsa,PROEXT - UFTM,"R$ 2.400,00"
284/2021,"Inventário do uso agrícola do solo no município de Uberaba, MG, por meio de geotecnologias.",RICARDO VICENTE FERREIRA,IELACHS,Projeto,Meio Ambiente,19/09/2021,12/09/2022,23/08/2021,16/09/2021,SIEX - Edital 09/2021 - com bolsa,PROEXT - UFTM,"R$ 4.800,00"
285/2021,Passeio Virtual 360° pelo Projeto Geopark Uberaba - Terra de Gigantes,JOSENILSON BERNARDO DA SILVA,IELACHS,Projeto,Educação,19/09/2021,12/09/2022,30/08/2021,16/09/2021,SIEX - Edital 09/2021 - com bolsa,PROEXT - UFTM,"R$ 1.600,00"
286/2021,Semana do Coração,FERNANDO DE MARTINO,ICS,Evento,Saúde,17/10/2021,24/10/2021,14/09/2021,16/09/2021,SIEX - Fluxo Contínuo,Não Tem Recurso Financeiro,----
287/2021,Semiologia em Dose Única: Aula Inaugural da Liga Acadêmica de Clínica Médica da UFTM,RODRIGO JULIANO MOLINA,ICS,Evento,Saúde,02/10/2021,02/10/2021,02/09/2021,17/09/2021,SIEX - Fluxo Contínuo,Não Tem Recurso Financeiro,----
288/2021,II Simpósio e Curso Introdutório à Liga Interdisciplinar de Saúde do Idoso,LISLEI JORGE PATRIZZI MARTINS,ICS,Evento,Saúde,09/08/2021,10/08/2021,14/07/2021,17/09/2021,SIEX - Fluxo Contínuo,Não Tem Recurso Financeiro,----
289/2021,Semear: Projeto de comunicação e divulgação da Licenciatura em Educação do Campo em territórios rurais,VERONICA KLEPKA,ICENE,Projeto,Educação,08/10/2021,30/11/2021,10/09/2021,20/09/2021,SIEX - Fluxo Contínuo,Não Tem Recurso Financeiro,----
290/2021,"7º JIEPE - Jornada Integrada de Ensino, Pesquisa e Extensão",FABRICIO ANIBAL CORRADINI,PROEXT,Evento,Comunicação,20/09/2021,31/12/2021,06/09/2021,27/09/2021,SIEX - Fluxo Contínuo,Não Tem Recurso Financeiro,----
291/2021,VI Seminário de Pesquisa do PROFLETRAS e Semana dos Cursos de Letras da UFTM,ELIZANDRA ZEULLI,IELACHS,Evento,Educação,28/09/2021,01/10/2021,20/09/2021,28/09/2021,SIEX - Fluxo Contínuo,Não Tem Recurso Financeiro,----
292/2021,XVIII Curso de Aperfeiçoamento em Nefropatologia   ,JULIANA REIS MACHADO E SILVA,ICBN,Curso,Saúde,04/10/2021,29/10/2021,22/09/2021,29/09/2021,SIEX - Fluxo Contínuo,FUNEPU                Não Tem Recurso Financeiro,"R$15.000,00"
293/2021,II Curso Introdutório da Liga Acadêmica de Nutrição e Atividade Física (LANAF). II Simpósio da LANAF,MARA CLEIA TREVISAN,ICS,Evento,Saúde,13/10/2021,04/11/2021,29/09/2021,30/09/2021,SIEX - Fluxo Contínuo,Não Tem Recurso Financeiro,----
294/2021,SaúdeInova: compartilhando habilidades essenciais ao profissional do futuro,LUCIANA DE ALMEIDA SILVA TEIXEIRA,ICS,Projeto,Saúde,23/09/2021,23/03/2022,23/08/2021,01/10/2021,SIEX - Fluxo Contínuo,Não Tem Recurso Financeiro,----
295/2021,IX Semana de Engenharia Civil,FABIO MARTIN ROCHA,ICTE,Evento,Tecnologia e Produção,18/10/2021,29/10/2021,03/10/2021,04/10/2021,SIEX - Fluxo Contínuo,Não Tem Recurso Financeiro,----
296/2021,1º Simpósio Interdisciplinar de Terapia Intensiva.,HUDSON HENRIQUE GOMES PIRES,ICS,Evento,Saúde,20/10/2021,20/10/2021,27/09/2021,05/10/2021,SIEX - Fluxo Contínuo,Não Tem Recurso Financeiro,----
297/2021,MULHERIDADES EM DEBATE,ANA PAULA FERNANDES,ICS,Evento,Saúde,22/10/2021,23/10/2021,30/09/2021,06/10/2021,SIEX - Fluxo Contínuo,Não Tem Recurso Financeiro,----
298/2021,V Jornada Integrada de Estudos Ambientais,CARLA ELOISA DINIZ DOS SANTOS,ICTE,Evento,Meio Ambiente,24/11/2021,25/11/2021,27/09/2021,06/10/2021,SIEX - Fluxo Contínuo,Não Tem Recurso Financeiro,----
299/2021,V Seminário de TCC da Educação Física/UFTM,DONIZETE CICERO XAVIER DE OLIVEIRA,ICS,Evento,Saúde,29/11/2021,01/12/2021,01/10/2021,07/10/2021,SIEX - Fluxo Contínuo,Não Tem Recurso Financeiro,----
300/2021 (Nº de registro alterado - ver planilha de 2022),I ENCONTRO DE TÉCNICO-ADMINISTRATIVOS EM EDUCAÇÃO DA UFTM – ETAE: contribuições para o desenvolvimento científico e institucional,WALESKA DAYSE DIAS DE SOUSA,ICENE,Evento,Trabalho,22/03/2022,24/03/2022,05/10/2021,07/10/2021,SIEX - Fluxo Contínuo,Não Tem Recurso Financeiro,----
301/2021,II SIMPÓSIO DA LIGA ACADÊMICA DE SAÚDE COLETIVA -LASC– UFTM,JULIANA MARTINS PINTO,ICS,Evento,Saúde,08/10/2021,29/10/2021,24/09/2021,08/10/2021,SIEX - Fluxo Contínuo,Não Tem Recurso Financeiro,----
302/2021,Liga Interdisciplinar de Saúde do Idoso,LISLEI JORGE PATRIZZI MARTINS,ICS,Liga Acadêmica (Programa),Saúde,25/10/2021,27/10/2022,20/09/2021,13/10/2021,SIEX - Fluxo Contínuo,Não Tem Recurso Financeiro,----
303/2021,1o Simpósio de Estágio Curricular Supervisionado do Curso de Engenharia de Alimentos da UFTM (1o SimEEAli),PAULO HENRIQUE MARIANO MARFIL,ICTE,Evento,Tecnologia e Produção,29/10/2021,29/12/2021,08/10/2021,13/10/2021,SIEX - Fluxo Contínuo,Não Tem Recurso Financeiro,----
304/2021,I Simpósio Introdutório à Liga Acadêmica de Gastroenterologia e Hepatologia da UFTM,GEISA PEREZ MEDINA GOMIDE,ICS,Evento,Saúde,27/10/2021,27/10/2021,22/09/2021,14/10/2021,SIEX - Fluxo Contínuo,Não Tem Recurso Financeiro,----
305/2021,II JORNADA DAS LICENCIATURAS DO ICENE - SEMANA INTEGRADA (BioFisQuiLeMat2021),CAMILA LIMA MIRANDA,ICENE,Evento,Educação,03/11/2021,05/11/2021,07/10/2021,18/10/2021,SIEX - Fluxo Contínuo,Não Tem Recurso Financeiro,----
306/2021,Projeto de Estimulação Precoce – Terapia Ocupacional (PEPTO),LUCIENY ALMOHALHA,ICS,Projeto,Saúde,11/11/2021,30/12/2022,14/10/2021,19/10/2021,SIEX - Fluxo Contínuo,Não Tem Recurso Financeiro,----
307/2021,Curso de formação em manejo de grupos,CONCEICAO APARECIDA SERRALHA,IELACHS,Curso ,Educação,27/10/2021,08/12/2021,29/09/2021,19/10/2021,SIEX - Fluxo Contínuo,Não Tem Recurso Financeiro,----
308/2021,II Encontro de Medicina do Estilo de Vida do Triângulo Mineiro,LISLEI JORGE PATRIZZI MARTINS,Coordenadoria dos Programas de Pós-graduação Stricto Sensu,Evento,Saúde,29/10/2021,29/10/2021,15/10/2021,21/10/2021,SIEX - Fluxo Contínuo,Não Tem Recurso Financeiro,----
309/2021,Liga Acadêmica de Avaliação Física,JEFFER EIDI SASAKI,Departamento de Desenvolvimento da Pós-graduação,Liga Acadêmica (Programa),Saúde,05/11/2021,30/11/2025,08/10/2021,21/10/2021,SIEX - Fluxo Contínuo,Não Tem Recurso Financeiro,----
310/2021,Liga Acadêmica de Saúde Esportiva (LASE),DANIEL FERREIRA MOREIRA LOBATO,PROPPG,Liga Acadêmica (Programa),Saúde,17/05/2021,30/04/2026,16/04/2021,22/10/2021,SIEX - Fluxo Contínuo,Não Tem Recurso Financeiro,----
311/2021,X JORNADA DE SAÚDE DO HOMEM,GILBERTO DE ARAUJO PEREIRA,ICS,Evento,Saúde,03/11/2021,23/12/2021,14/10/2021,22/10/2021,SIEX - Fluxo Contínuo,Não Tem Recurso Financeiro,----
312/2021,Atendimento Humanizado e Integral: ações da equipe multiprofissional a pacientes com lesão crônica em um ambulatório de um Hospital Universitário ,LUCIA APARECIDA FERREIRA,ICS,Projeto,Saúde,25/10/2021,16/03/2022,27/09/2021,25/10/2021,SIEX - Fluxo Contínuo,Não Tem Recurso Financeiro,----
313/2021,1ª Semana de Conscientização em Saúde e Esporte da LAMIE,MURILO ANTONIO ROCHA,PROENS,Projeto,Saúde,15/11/2021,26/11/2021,17/10/2021,26/10/2021,SIEX - Fluxo Contínuo,Não Tem Recurso Financeiro,----
314/2021,Liga Acadêmica de Cuidados Paliativos 2021,LEILA APARECIDA KAUCHAKJE PEDROSA,ICS,Liga Acadêmica (Programa),Saúde,08/11/2021,18/11/2022,10/10/2021,26/10/2021,SIEX - Fluxo Contínuo,Não Tem Recurso Financeiro,----
315/2021,I Simpósio de Atividades Aquáticas: a extensão universitária na formação profissional - 10 anos do Aqua/UFTM,ALINE DESSUPOIO CHAVES,Pró-reitoria de Ensino,Evento,Saúde,08/11/2021,11/11/2021,20/10/2021,27/10/2021,SIEX - Fluxo Contínuo,Não Tem Recurso Financeiro,----
316/2021 (proposta cancelada),"Prospecção de oportunidades de Pesquisa, Desenvolvimento e Inovação entre a UFTM e o setor privado",DOUGLAS MOURA MIRANDA,Núcleo de Inovação Tecnológica,Programa,Tecnologia e Produção,1/12/2021,30/11/2026,19/10/2021,28/10/2021,SIEX - Fluxo Contínuo,Não Tem Recurso Financeiro,----
317/2021,"XVI Encontro Internacional de Estudos Medievais - ""Sob o véu de versos estranhos"": Dante em perspectiva multidisciplinar",CLAUDIA REGINA BOVO,IELACHS,Evento,Educação,24/11/2021,26/11/2021,20/10/2021,28/10/2021,SIEX - Fluxo Contínuo,Não Tem Recurso Financeiro,----
318/2021,Utilização dos Sistemas de Informação em Saúde (DATASUS) para pesquisa e gestão em saúde,SIOMAR DE CASTRO SOARES,Departamento de Desenvolvimento de Pesquisa e Inovação Tecnológica,Curso,Saúde,01/11/2021,29/11/2021,14/10/2021,29/10/2021,SIEX - Fluxo Contínuo,Não Tem Recurso Financeiro,----
319/2021,Novembro Azul 2021 - Campanha de Combate ao Câncer de Próstata ,LUIS GUSTAVO FAGUNDES NUNES,ICS,EVENTO,SAÚDE,05/11/2021,07/12/2021,22/10/0202,29/10/2021,SIEX - Fluxo Contínuo,Não Tem Recurso Financeiro,----
320/2021,Oferta de Cursos Técnicos/Cefores pelo Projeto Trilhas de Futuro,PAULO ROBERTO DA SILVA,CEFORES,Projeto,Educação,25/10/2021,25/10/2023,29/10/2021,29/10/2021,SIEX - Fluxo Contínuo,FUNEPU,"R$ 1.477.582,30"
321/2021,Festival Cultural de Uberaba ,LUIZ FERNANDO RESENDE DOS SANTOS ANJO,Reitoria/UFTM,Projeto,Cultura,08/06/2021,31/12/2021,29/09/2021,29/10/2021,SIEX - Fluxo Contínuo,PROEXT - UFTM (2 Bolsas de Extensão - 05 meses - ago a dez/21 - Edital nº 10/2021),"R$ 4.000,00"
322/2021,"I simpósio Grupo de Pesquisa em Fisiologia Aplicada, Nutrição e Exercício da UFTM.",MARKUS VINICIUS CAMPOS SOUZA,ICS,Evento,Saúde,29/11/2021,01/12/2021,22/10/2021,29/10/2021,SIEX - Fluxo Contínuo,Não Tem Recurso Financeiro,----
323/2021,X Semana de História da UFTM,FABIO AFONSO FRIZZO DE MORAES LIMA,IELACHS,Evento,Educação,22/10/2021,26/11/2021,11/11/2021,11/11/2021,SIEX - Fluxo Contínuo,Não Tem Recurso Financeiro,----
324/2021,CURSINHO DE EDUCAÇÃO POPULAR - CEPOP,ANA PALMIRA SOARES DOS SANTOS,CEFORES,Programa,Educação,11/05/2021,12/05/2022,06/10/2021,12/11/2021,SIEX - Fluxo Contínuo,Não Tem Recurso Financeiro,----
