104/2021,ESTUDO DA VIABILIZAÇÃO EXECUÇÃO DE TESTES DE EFICIÊNCIA EM MASCARAS CIRÚRGICAS COM BASE NA NORMA ABNT 13698/2011,Márcio de Queiroz Murad ,CEFORES,Projeto,Tecnologia e Produção,01/04/2021,01/01/2022,22/02/2021,31/03/2021,SIGProj - EDITAL PROEXT/CEFORES 02/2021 - com bolsa,CEFORES,"R$ 3.600,00"
105/2021,Família Fisio UFTM - Ano I,CRISTIANE VITALIANO GRAMINHA,ICS,Projeto,Saúde,06/04/2021,17/12/2021,05/03/2021,05/04/2021,SIEX - Fluxo Contínuo,Não Tem Recurso Financeiro,----
106/2021,Liga Acadêmica de Terapias Integrativas,EDUARDO ELIAS VIEIRA DE CARVALHO,ICS,Liga Acadêmica (Programa),Saúde,26/04/2021,31/12/2021,26/03/2021,05/04/2021,SIEX - Fluxo Contínuo,Não Tem Recurso Financeiro,----
107/2021,Dedinho de Prosa - Edição 2021,MARCOS VINICIUS DA SILVA,ICBN,Projeto,Saúde,05/04/2021,31/08/2021,08/03/2021,05/04/2021,SIEX - Fluxo Contínuo,Não Tem Recurso Financeiro,----
108/2021,Apoio Pedagógico aos alunos do Programa de Auxílios Financeiros – PAF da UFTM,TENISZIARA DE MOURA FERREIRA,PROACE,Evento,Educação,29/04/2021,24/05/2021,05/04/2021,07/04/2021,SIEX - Fluxo Contínuo,Não Tem Recurso Financeiro,----
109/2021,XI Simpósio e XII Curso Introdutório à Liga de Cirurgia Plástica e Dermatologia da UFTM,MANOEL PEREIRA DA SILVA NETO,ICS,Evento,Saúde,28/04/2021,28/04/2021,03/04/2021,08/04/2021,SIEX - Fluxo Contínuo,Não Tem Recurso Financeiro,----
110/2021,ALMANAQUE DA CIÊNCIA,Andreia Fernandes Malaquias,Proext,Projeto,Cultura,01/04/2021,01/04/2023,17/02/2021,09/04/2021,SIEX - Fluxo Contínuo,Não Tem Recurso Financeiro,----
111/2021, IV Simpósio e Curso Introdutório à Liga Acadêmica de Cirurgia Geral (LAC UFTM),LUIS GUSTAVO FAGUNDES NUNES,ICS,Evento,Saúde,12/04/2021,12/04/2021,25/03/2021,09/04/2021,SIEX - Fluxo Contínuo,Não Tem Recurso Financeiro,----
112/2021,XVIII Simpósio de Urgências e Emergências Traumáticas,EDUARDO CREMA,ICS,Evento,Saúde,06/05/2021,06/05/2021,05/04/2021,12/04/2021,SIEX - Fluxo Contínuo,Não Tem Recurso Financeiro,----
113/2021,I Simpósio Introdutório à LACEC,FERNANDA MACHADO FONSECA,ICS,Evento,Saúde,15/04/2021,15/04/2021,01/04/2021,12/04/2021,SIEX - Fluxo Contínuo,Não Tem Recurso Financeiro,----
114/2021,Programa Multimidiático,Ana Paula Bossler da Costa,ICENE,Programa,Cultura,01/04/2021,01/04/2026,11/02/2021,12/04/2021,SIEX - Fluxo Contínuo,PROEXT - UFTM (2 Bolsas de Extensão - 09 meses/2021 - PS DDCULT nº 06/2021) / (02 bolsas de Extensão - 09 meses/2022 - Ed. PROEXT 13/2021),"R$ 7.200,00 / R$ 7.200,00"
115/2021,Liga Acadêmica de Cirurgia Geral da UFTM (LAC UFTM),LUIS GUSTAVO FAGUNDES NUNES,ICS,Liga Acadêmica (Programa),Saúde,23/04/2021,23/04/2022,26/03/2021,12/04/2021,SIEX - Fluxo Contínuo,Não Tem Recurso Financeiro,----
116/2021,Exposições científicas: o Museu dos Dinossauros,THIAGO DA SILVA MARINHO,ICENE,Programa,Meio Ambiente,15/03/2021,15/03/2022,08/04/2021,12/04/2021,SIEX - Fluxo Contínuo,PROEXT - UFTM (2 Bolsas de Extensão - 09 meses/2021 - PS DDCULT nº 06/2021) - (02 Bolsas de Extensão - 09 meses/2022 - Edital 13/2021),"R$ 7.200,00 / R$ 7.200,00"
117/2021,I Simpósio da Liga Acadêmica de Estética Avançada,MARCIA ANTONIAZI MICHELIN,ICBN,Evento,Saúde,28/04/2021,29/04/2021,09/04/2021,14/04/2021,SIEX - Fluxo Contínuo,Não Tem Recurso Financeiro,----
118/2021,Dia Nacional da Matemática na UFTM,RAFAEL RODRIGO OTTOBONI,ICENE,Evento,Educação,06/05/2021,06/05/2021,09/04/2021,14/04/2021,SIEX - Fluxo Contínuo,Não Tem Recurso Financeiro,----
119/2021,ENEM te conto,CARLO JOSE FREIRE DE OLIVEIRA,PROPPG,Evento,Educação,29/04/2021,30/04/2021,11/04/2021,14/04/2021,SIEX - Fluxo Contínuo,Não Tem Recurso Financeiro,----
120/2021,ResIdoso – Redes Sociais como Educação Interdisciplinar na Promoção de Saúde do Idoso,SURAYA GOMES NOVAIS SHIMANO,ICS,Projeto,Saúde,01/05/2021,28/02/2022,01/04/2021,14/04/2021,SIEX - Fluxo Contínuo,Não Tem Recurso Financeiro,----
121/2021,Geopark Uberaba: educação patrimonial,JOSENILSON BERNARDO DA SILVA,IELACHS,Programa,Cultura,22/03/2021,15/03/2023,08/04/2021,14/04/2021,SIEX - Fluxo Contínuo,PROEXT - UFTM (2 Bolsas de Extensão - 09 meses/2021 - PS DDCULT nº 06/2021) / (2 Bolsas de Extensão - 09 meses/2022 - Edital nº 13/2021),"R$ 7.200,00 / R$ 7.200,00"
122/2021,Minicurso: Telessaúde e Educação para a comunidade,JULIANA MARTINS PINTO,ICS,Evento,Saúde,29/04/2021,29/04/2021,06/04/2021,14/04/2021,SIEX - Fluxo Contínuo,Não Tem Recurso Financeiro,----
123/2021,Liga Acadêmica de Anestesiologia,LUCIANO ALVES MATIAS DA SILVEIRA,ICS,Liga Acadêmica (Programa),Saúde,22/04/2021,31/12/2021,24/03/2021,15/04/2021,SIEX - Fluxo Contínuo,Não Tem Recurso Financeiro,----
124/2021,Revista: Diário das Engenharias,PRISCILA PEREIRA SILVA,ICTE,Projeto,Tecnologia e Produção,10/05/2021,10/05/2023,09/04/2021,15/04/2021,SIEX - Fluxo Contínuo,Não Tem Recurso Financeiro,----
125/2021,X Simpósio e Curso Introdutório da Liga Acadêmica de Diabetes Mellitus,MARIA DE FATIMA BORGES,ICS,Evento,Saúde,22/04/2021,22/04/2021,05/04/2021,15/04/2021,SIEX - Fluxo Contínuo,Não Tem Recurso Financeiro,----
126/2021,I Simpósio e Curso Introdutório da Liga Acadêmica de Transplantes de Órgãos e Tecidos ,VILMAR DE PAIVA MARQUES,ICS,Evento,Saúde,05/05/2021,05/05/2021,30/03/2021,16/04/2021,SIEX - Fluxo Contínuo,Não Tem Recurso Financeiro,----
127/2021,1º Simpósio Introdutório de Medicina Integrada ao Exercício,MURILO ANTONIO ROCHA,ICS,Evento,Saúde,22/04/2021,23/04/2021,08/04/2021,19/04/2021,SIEX - Fluxo Contínuo,Não Tem Recurso Financeiro,----
128/2021,Nossa Jornada,MARCOS VINÍCIUS DA SILVA,ICBN,Programa,Educação,15/05/2021,31/08/2023,15/04/2021,19/04/2021,SIEX - Fluxo Contínuo,Não Tem Recurso Financeiro,----
129/2021,"Formação Docente em Interseccionalidade de Raça, Gênero, Sexualidade e Classe",LEANDRA DOMINGUES SILVERIO,IELACHS,Curso,Educação,17/05/2021,31/07/2021,16/04/2021,19/04/2021,SIEX - Fluxo Contínuo,Não Tem Recurso Financeiro,----
130/2021,Psicologia e Relações Étnico Raciais,AILTON DE SOUZA ARAGAO,ICS,Curso,Saúde,01/06/2021,30/06/2021,19/04/2021,22/04/2021,SIEX - Fluxo Contínuo,Não Tem Recurso Financeiro,----
131/2021,Liga Acadêmica de Transplante de Órgãos e Tecidos - LATOT,VILMAR DE PAIVA MARQUES,ICS,Liga Acadêmica (Programa),Saúde,27/04/2021,01/04/2022,30/03/2021,22/04/2021,SIEX - Fluxo Contínuo,Não Tem Recurso Financeiro,----
132/2021,Liga Acadêmica de Psicologia Jurídica e Serviço Social,HELGA YURI SILVA OKANO ANDRADE,IELACHS,Liga Acadêmica (Programa),Direitos Humanos e Justiça,06/05/2021,06/05/2022,08/04/2021,23/04/2021,SIEX - Fluxo Contínuo,Não Tem Recurso Financeiro,----
133/2021,"2º Ciclo de Estudos do NEduC - Núcleo de Educação em Ciências, Diversidade e Práticas Ambientais - ""Estratégias e Práticas Pedagógicas de Ensino e Aprendizagem""",JAMES ROGADO,CAMPUS UNIVERSITÁRIO DE ITURAMA,Evento,EDUCAÇÃO,26/04/2021,30/11/2021,12/04/2021,23/04/2021,SIEX - Fluxo Contínuo,Não Tem Recurso Financeiro,----
134/2021,Teleatendimeto/Telesaúde de Pilates na deficiência visual,NUNO MIGUEL LOPES DE OLIVEIRA,ICS,Projeto,Saúde,17/05/2021,16/12/2021,20/04/2021,26/04/2021,SIEX - Fluxo Contínuo,Não Tem Recurso Financeiro,----
135/2021,Massagem Shantala na UFTM e redes sociais,NUNO MIGUEL LOPES DE OLIVEIRA,ICS,Projeto,Saúde,27/05/2021,16/12/2021,20/04/2021,26/04/2021,SIEX - Fluxo Contínuo,Não Tem Recurso Financeiro,----
136/2021,Boas-Vindas aos Discentes Bolsistas Extensionistas - 2ª Edição/2021,KAREN RIBEIRO INACIO DE OLIVEIRA,Proext,Evento,Educação,30/04/2021,30/04/2021,23/04/2021,26/04/2021,SIEX - Fluxo Contínuo,Não Tem Recurso Financeiro,----
137/2021,VI Simpósio Mineiro de Educação Química,LUCIANA CAIXETA BARBOZA,ICENE,Evento,Educação,14/06/2021,18/06/2021,19/04/2021,28/04/2021,SIEX - Fluxo Contínuo,Não Tem Recurso Financeiro,----
138/2021,Dia do Físico e da Física - Milton Taidi Sonoda,NATALIA BUENO LEITE SLADE,ICENE,Evento,Trabalho,19/05/2021,19/05/2021,26/04/2021,29/04/2021,SIEX - Fluxo Contínuo,Não Tem Recurso Financeiro,----
139/2021,"1ª Semana de Inovação, Tecnologia e Empreendedorismo",CAMILA NAVES ARANTES,AGÊNCIA UFTM DE INOVAÇÃO,Evento,Tecnologia e Produção,24/05/2021,27/05/2021,29/04/2021,29/04/2021,SIEX - Fluxo Contínuo,Não Tem Recurso Financeiro,----
140/2021, 12º Encontro Comemorativo ao Dia Nacional da Adoção,CLAUDIA HELENA JULIAO,IELACHS,Evento,Direitos Humanos e Justiça,25/05/2021,25/05/2021,28/04/2021,30/04/2021,SIEX - Fluxo Contínuo,Não Tem Recurso Financeiro,----
141/2021,Liga Acadêmica de Bioinformática e Biologia Molecular,ANDRE LUIZ PEDROSA,ICBN,Liga Acadêmica (Programa),Saúde,02/06/2021,15/12/2021,22/04/2021,03/05/2021,SIEX - Fluxo Contínuo,Não Tem Recurso Financeiro,----
142/2021,Liga Acadêmica de Cuidados Paliativos em Pediatria,JUSSARA SILVA LIMA,ICS,Liga Acadêmica (Programa),Saúde,03/05/2021,03/04/2026,05/04/2021,03/05/2021,SIEX - Fluxo Contínuo,Não Tem Recurso Financeiro,----
143/2021,"4ª ESCOLA DE INVERNO EM QUÍMICA DO PONTAL DO TRIÂNGULO MINEIRO - ""Laboratórios Virtuais para o Ensino de Ciências""",JAMES ROGADO,CAMPUS UNIVERSITÁRIO DE ITURAMA,Curso,Educação,26/07/2021,30/07/2021,03/05/2021,04/05/2021,SIEX - Fluxo Contínuo,Não Tem Recurso Financeiro,----
144/2021,Vacinas e fake news: uma abordagem para educação básica,CATARINA TEIXEIRA,ICENE,Projeto,Educação,10/05/2021,01/10/2021,12/04/2021,04/05/2021,SIEX - Fluxo Contínuo,Não Tem Recurso Financeiro,----
145/2021,JORNADAS DE DISCUSSÃO DO GEPPEC/LAFICS - 3a. Edição: A CORROSÃO DA DEMOCRACIA E AS NOVAS FORMAS DE AUTORITARISMO,IDALICE RIBEIRO SILVA LIMA,IELACHS,Projeto,Educação,01/06/2021,27/12/2021,03/05/2021,04/05/2021,SIEX - Fluxo Contínuo,Não Tem Recurso Financeiro,----
146/2021,Vida Ativa,CAMILA BOSQUIERO PAPINI,ICS,Projeto,Saúde,01/06/2021,28/02/2022,19/04/2021,05/05/2021,SIEX - Fluxo Contínuo,Não Tem Recurso Financeiro,----
147/2021,Liga Acadêmica Interdisciplinar de Terapia Intensiva,HUDSON HENRIQUE GOMES PIRES,ICS,Liga Acadêmica (Programa),Saúde,24/05/2021,05/04/2022,24/03/2021,05/05/2021,SIEX - Fluxo Contínuo,Não Tem Recurso Financeiro,----
148/2021,Observação atenta da Natureza: o olhar do cientista e do poeta,JONAS BACH JUNIOR,IELACHS,Curso,Educação,17/05/2021,17/08/2021 Término antecipado conforme relatório final,16/04/2021,06/05/2021,SIEX - Fluxo Contínuo,Não Tem Recurso Financeiro,----
149/2021,OFICINAS VIRTUAIS CHAGASLEISH 2021 - REUNIÃO ANUAL DE PESQUISA APLICADA EM DOENÇA DE CHAGAS E LEISHMANIOSES,LUCIANA DE ALMEIDA SILVA TEIXEIRA        ,ICS,Evento,Saúde,14/05/2021,14/08/2021,16/04/2021,06/05/2021,SIEX - Fluxo Contínuo,Não Tem Recurso Financeiro,----
150/2021,Pet Serviço Social em CENAS: Desigualdade Social em Cena sob o Olhar de Carolina Maria de Jesus ,REGINA MAURA REZENDE,IELACHS,Projeto,Direitos Humanos e Justiça,31/05/2021,10/12/2021,28/04/2021,06/05/2021,SIEX - Fluxo Contínuo,Não Tem Recurso Financeiro,----
151/2021,Aula Aberta 1 -  Alienação Parental: Aspectos Jurídicos e Psíquicos,LUCIANA MARIA DA SILVA,ICS,Evento,Direitos Humanos e justiça,20/05/2021,20/05/2021,05/05/2021,07/05/2021,SIEX - Fluxo Contínuo,Não Tem Recurso Financeiro,----
152/2021,Meu Futuro - Edição 01,MARCOS VINICIUS DA SILVA,ICBN,Projeto,Educação,30/05/2021,30/09/2021,29/04/2021,07/05/2021,SIEX - Fluxo Contínuo,Não Tem Recurso Financeiro,----
153/2021,"“Temas em Adolescer: problematizar saberes, ampliar fazeres”",AILTON DE SOUZA ARAGAO,ICS,Curso,Saúde,07/06/2021,31/08/2021,05/05/2021,07/05/2021,SIEX - Fluxo Contínuo,Não Tem Recurso Financeiro,----
154/2021,II RODA DE CONVERSA SOBRE COOPERAÇÃO ACADÊMICA BRASIL-ÁFRICA,DANILO SEITHI KATO,ICENE,Evento,Educação,31/05/2021,31/05/2021,03/05/2021,10/05/2021,SIEX - Fluxo Contínuo,Não Tem Recurso Financeiro,----
155/2021,"Programa Interfaces entre Artes, Ciências & Matemática",ALBERTO LUIZ PEREIRA DA COSTA,ICENE,Programa,Cultura,21/03/2021,31/03/2025,09/04/2021,10/05/2021,SIEX - Fluxo Contínuo,PROEXT - UFTM (2 Bolsas de Extensão - 09 meses/2021 - PS DDCULT nº 06/2021) - (01 Bolsa de Extensão - 09 meses/2022 - Edital 13/2021),"R$ 7.200,00 / R$ 3.600,00"
156/2021,Atividades Lúdicas no Museu dos Dinossauros,THIAGO HENRIQUE BARNABE CORREA,ICENE,Programa,Cultura,15/03/2021,15/03/2023,08/04/2021,10/05/2021,SIEX - Fluxo Contínuo,PROEXT - UFTM (1 Bolsa de Extensão - 09 meses/2021 - PS DDCULT nº 06/2021) / (02 bolsas de Extensão - 09 meses/2022 - Ed. PROEXT 13/2021),"R$ 3.600,00 / R$ 7.200,00"
157/2021,IX SeAli: Semana Acadêmica da Engenharia de Alimentos da UFTM,EVANDRO ROBERTO ALVES,ICTE,Evento,Tecnologia e Produção,31/07/2021,25/08/2021,05/05/2021,10/05/2021,SIEX - Fluxo Contínuo,Não Tem Recurso Financeiro,----
158/2021,Meu veterano - Edição 01,MARCOS VINICIUS DA SILVA,ICBN,Projeto,Educação,30/05/2021,30/09/2021,29/04/2021,11/05/2021,SIEX - Fluxo Contínuo,Não Tem Recurso Financeiro,----
159/2021,Liga Universitária da Amamentação,LUCIANO BORGES SANTIAGO,ICS,Liga Acadêmica (Programa),Saúde,28/04/2021,28/03/2026,31/03/2021,11/05/2021,SIEX - Fluxo Contínuo,Não Tem Recurso Financeiro,----
160/2021,VIII Fórum de Estágio em Serviço Social da UFTM: “ O estágio e supervisão em Serviço Social na pandemia: desafios e estratégias”,REGINA MAURA REZENDE,IELACHS,Evento,Educação,26/05/2021,26/05/2021,07/05/2021,11/05/2021,SIEX - Fluxo Contínuo,Não Tem Recurso Financeiro,----
161/2021,"37ª Semana de Enfermagem da UFTM: ""Enfermagem na ""linha de frente"" em contextos de crise""",FLAVIA APARECIDA DIAS MARMO,ICS,Evento,Saúde,12/05/2021,13/05/2021,29/04/2021,11/05/2021,SIEX - Fluxo Contínuo,Não Tem Recurso Financeiro,----
162/2021,LIGA ACADÊMICA DE EMBRIOLOGIA E REPRODUÇÃO_FERTILIGA,ROSEANE LOPES DA SILVA GRECCO,ICBN,Liga Acadêmica (Programa),Saúde,02/06/2021,02/06/2022,05/05/2021,11/05/2021,SIEX - Fluxo Contínuo,Não Tem Recurso Financeiro,----
163/2021,VIII Mostra de Projetos dos Trabalhos de Conclusão de Curso da Licenciatura em Matemática 2020-2 ,MARCELA LUCIANO VILELA DE SOUZA,ICENE,Evento,Educação,03/05/2021,03/07/2021,17/04/2021,12/05/2021,SIEX - Fluxo Contínuo,Não Tem Recurso Financeiro,----
164/2021,"2º Seminário ""Patrimônio Cultural e Ensino de História""",ILANA PELICIARI ROCHA,IELACHS,Evento,Educação,19/05/2021,21/05/2021,03/05/2021,12/05/2021,SIEX - Fluxo Contínuo,Não Tem Recurso Financeiro,----
165/2021,3° Simpósio e Curso Introdutório à Liga Acadêmica de Cardiologia da UFTM (LaCardio-UFTM),FERNANDO DE MARTINO,ICS,Evento,Saúde,25/05/2021,26/05/2021,04/05/2021,13/05/2021,SIEX - Fluxo Contínuo,Não Tem Recurso Financeiro,----
166/2021,MAFA (Mãos e Almas Fazendo Arte),SURAYA GOMES NOVAIS SHIMANO,ICS,Projeto,Educação,01/06/2021,20/12/2021,30/04/2021,13/05/2021,SIEX - Fluxo Contínuo,Não Tem Recurso Financeiro,----
167/2021,Laboratório de História Pública UFTM,MARCELO DE SOUZA SILVA,IELACHS,Projeto,Comunicação,02/06/2021,02/06/2022,05/05/2021 (23:41),13/05/2021,SIEX - Fluxo Contínuo,Não Tem Recurso Financeiro,----
168/2021,Comunidades Escolares Aprendentes (CEAs): uma proposta de formação compartilhada entre Universidade e Instituições Estaduais de Ensino,JAMES ROGADO,CIT,Programa,Educação,07/06/2021,30/04/2026,07/05/2021    (21:17),13/05/2021,SIEX - Fluxo Contínuo,Não Tem Recurso Financeiro,----
169/2021,I Simpósio Introdutório à Liga Acadêmica de Bioinformática e Biologia Molecular,ANDRE LUIZ PEDROSA,ICBN,Curso,Saúde,25/05/2021,26/05/2021,22/04/2021,14/05/2021,SIEX - Fluxo Contínuo,Não Tem Recurso Financeiro,----
170/2021,III Simpósio Introdutório à FERTILIGA,ROSEANE LOPES DA SILVA GRECCO,ICBN,Evento,Saúde,27/05/2021,27/05/2021,04/05/2021,14/05/2021,SIEX - Fluxo Contínuo,Não Tem Recurso Financeiro,----
171/2021,"Rodas de Conversa: Controle sobre os corpos, machismo e patriarcado e suas repercussões para a saúde feminina",CLAUDIA DE AZEVEDO AGUIAR,ICS,Projeto,Saúde,07/06/2021,04/12/2021,10/05/2021,14/05/2021,SIEX - Fluxo Contínuo,Não Tem Recurso Financeiro,----
172/2021,A UFTM – Iturama em diálogo com a sociedade ituramense: qualidade de vida em foco ,ELISANGELA RODRIGUES CARRIJO,Assessoria em Assuntos Comunitários e Estudantis - Campus Universitário de Iturama,Projeto,Saúde,10/06/2021,10/06/2022,13/05/2021,18/05/2021,SIEX - Fluxo Contínuo,Não Tem Recurso Financeiro,----
173/2021,BioMatch - Mentoria Profissional: conectando a graduação com o mercado de trabalho,MARCOS VINICIUS DA SILVA,ICBN,Projeto,Educação,30/05/2021,30/09/2021,29/04/2021,19/05/2021,SIEX - Fluxo Contínuo,Não Tem Recurso Financeiro,----
174/2021,Baja UFTM,MARCOS MASSAO SHIMANO,ICTE,Projeto,Tecnologia e Produção,07/06/2021,31/12/2021,10/05/2021,19/05/2021,SIEX - Fluxo Contínuo,Não Tem Recurso Financeiro,----
175/2021,Cuidado em Liberdade: memórias da Luta Antimanicomial e experiências nos serviços da Rede de Atenção Psicossocial,ROSIMAR ALVES QUERINO,ICS,Projeto,Saúde,08/06/2021,30/11/2021,07/05/2021,20/05/2021,SIEX - Fluxo Contínuo,Não Tem Recurso Financeiro,----
176/2021,Posts informativos em Nutrição e Atividade Física,MARA CLEIA TREVISAN,ICS,Projeto,Saúde,02/06/2021,23/12/2021,05/05/2021,21/05/2021,SIEX - Fluxo Contínuo,Não Tem Recurso Financeiro,----
177/2021,Liga de Obstetrícia (LIO),CLAUDIA DE AZEVEDO AGUIAR,ICS,Liga Acadêmica (Programa),Saúde,08/06/2021,14/12/2021,11/05/2021,21/05/2021,SIEX - Fluxo Contínuo,Não Tem Recurso Financeiro,----
178/2021,Liga Acadêmica de Cardiologia da UFTM (LaCardio-UFTM),FERNANDO DE MARTINO,ICS,Liga Acadêmica (Programa),Saúde,08/06/2021,30/04/2022,07/05/2021,21/05/2021,SIEX - Fluxo Contínuo,Não Tem Recurso Financeiro,----
179/2021,Liga do Trauma,EDUARDO CREMA   alterado para ROBERTO DA MATA LENZA em 25/02/2022,ICS,Liga Acadêmica (Programa),Saúde,01/06/2021,01/06/2022,05/05/2021,21/05/2021,SIEX - Fluxo Contínuo,Não Tem Recurso Financeiro,----
180/2021,III Simpósio e Curso Introdutório à liga Acadêmica de Neonatologia,VALERIA CARDOSO ALVES CUNALI,ICS,Evento,Saúde,23/06/2021,23/06/2021,17/05/2021,24/05/2021,SIEX - Fluxo Contínuo,Não Tem Recurso Financeiro,----
181/2021,Programa PROMOVER: atenção integral à pessoa com deficiência,SURAYA GOMES NOVAIS SHIMANO,ICS,Programa,Saúde,06/06/2021,10/06/2022,05/05/2021,24/05/2021,SIEX - Fluxo Contínuo,Não Tem Recurso Financeiro,----
182/2021,Roda de conversa: a relação entre maternidade e o meio acadêmico,CONCEICAO APARECIDA SERRALHA,IELACHS,Evento,Saúde,26/05/2021,26/05/2021,12/05/2021,24/05/2021,SIEX - Fluxo Contínuo,Não Tem Recurso Financeiro,----
183/2021,Liga Acadêmica de Diabetes Mellitus 2021,MARIA DE FATIMA BORGES,ICS,Liga Acadêmica (Programa),Saúde,31/05/2021,06/12/2021,17/04/2021,24/05/2021,SIEX - Fluxo Contínuo,Não Tem Recurso Financeiro,----
184/2021,Colírio Blues,OZIRIS BORGES FILHO,IELACHS,Projeto,Comunicação,19/06/2021,31/12/2021,20/05/2021,26/05/2021,SIEX - Fluxo Contínuo,Não Tem Recurso Financeiro,----
185/2021,Seminários do Grupo Topus,OZIRIS BORGES FILHO,IELACHS,Evento,Educação,16/06/2021,31/08/2021,24/05/2021,26/05/2021,SIEX - Fluxo Contínuo,Não Tem Recurso Financeiro,----
186/2021,Liga Acadêmica de Humanização Sarakura 2021,ANA LUCIA DE ASSIS SIMOES,ICS,Liga Acadêmica (Programa),Saúde,21/06/2021,21/06/2022,17/05/2021,27/05/2021,SIEX - Fluxo Contínuo,Não Tem Recurso Financeiro,----
187/2021,Prosa científica. Encontro com o NEPSMAD.,ANDREA RUZZI PEREIRA,ICS,Evento,Saúde,10/06/2021,09/12/2021,12/05/2021,31/05/2021,SIEX - Fluxo Contínuo,Não Tem Recurso Financeiro,----
188/2021,(+)Nutrição & Saúde,RENATA DAMIAO,ICS,Projeto,Saúde,21/06/2021,02/06/2022,24/05/2021,01/06/2021,SIEX - Fluxo Contínuo,Não Tem Recurso Financeiro,----
189/2021,Telemonitoramento do desenvolvimento motor do lactente de risco,ELAINE LEONEZI GUIMARAES,ICS,Projeto,Saúde,22/06/2021,22/12/2021,25/05/2021,02/06/2021,SIEX - Fluxo Contínuo,Não Tem Recurso Financeiro,----
190/2021,Corporeidade e Saúde: Questões contemporâneas,VITOR HUGO DE OLIVEIRA,ICS,Curso,Saúde,05/08/2021,02/09/2021,13/05/2021,07/06/2021,SIEX - Fluxo Contínuo,Não Tem Recurso Financeiro,----
191/2021,CAFITUR - Apoiando o comercio da agricultura familiar e desenvolvimento local em Iturama e região,ARIANE FERNANDES DA CONCEICAO,CAMPUS UNIVERSITÁRIO DE ITURAMA,Projeto,Comunicação,29/06/2021,01/07/2023,01/06/2021,08/06/2021,SIEX - Fluxo Contínuo,Não Tem Recurso Financeiro,----
192/2021,IX Simpósio e XIV Curso Introdutório à Liga Acadêmica de Humanização Sarakura: 'Todo mundo pode ser palhaço?',ANA LÚCIA DE ASSIS SIMÕES,ICS,Evento,Saúde,19/06/2021,07/07/2021,17/05/2021,10/06/2021,SIEX - Fluxo Contínuo,Não Tem Recurso Financeiro,----
193/2021,XX Simpósio e Curso Introdutório da Liga de Hipertensão Arterial da UFTM,LUIZ ANTONIO PERTILI RODRIGUES DE RESENDE,HC,Evento,Saúde,15/06/2021,16/06/2021,31/05/2021,14/06/2021,SIEX - Fluxo Contínuo,Não Tem Recurso Financeiro,----
194/2021,Aula Aberta 2 – Guarda compartilhada: uma visão psicojurídica,LUCIANA MARIA DA SILVA,ICS,Evento,Direitos Humanos e Justiça,21/06/2021,02/07/2021,07/06/2021,15/06/2021,SIEX - Fluxo Contínuo,Não Tem Recurso Financeiro,----
195/2021,Atenção em Saúde Bucal,VIRGINIA OLIVEIRA CREMA,ICBN,Projeto,Saúde,30/06/2021,30/06/2022,02/06/2021,16/06/2021,SIEX - Fluxo Contínuo,Não Tem Recurso Financeiro,----
196/2021,"IX INTERPET - PET que ""bixo"" é esse?",CLAUDIA REGINA BOVO,IELACHS,Evento ,Educação,03/07/2021,03/07/2021,06/06/2021,16/06/2021,SIEX - Fluxo Contínuo,Não Tem Recurso Financeiro,----
197/2021,LIGA ACADÊMICA MULTIPROFISSIONAL DE ATENÇÃO HOSPITALAR-LAMAH,GILBERTO DE ARAUJO PEREIRA,ICS,Liga Acadêmica (Programa),Saúde,09/07/2021,31/12/2022,11/06/2021,17/06/2021,SIEX - Fluxo Contínuo,Não Tem Recurso Financeiro,----
198/2021,AMBULATÓRIO DE SÍNDROME PÓS-COVID,GUSTAVO JOSE LUVIZUTTO,ICS,Prestação de Serviços,Saúde,20/07/2021,20/06/2022,16/06/2021,21/06/2021,SIEX - Fluxo Contínuo,Não Tem Recurso Financeiro,----
199/2021,Liga Acadêmica de Reabilitação Cardiovascular,LUCIANA DUARTE NOVAIS SILVA,ICS,Liga Acadêmica (Programa),Saúde,05/07/2021,22/12/2021,01/06/2021,22/06/2021,SIEX - Fluxo Contínuo,Não Tem Recurso Financeiro,----
200/2021,Projeto Desmistificando a Vacina,LUCIANO ALVES MATIAS DA SILVEIRA,ICS,Projeto,Saúde,30/06/2021,17/12/2021,02/06/2021,22/06/2021,SIEX - Fluxo Contínuo,Não Tem Recurso Financeiro,----
201/2021,Orientações pré-anestésicas por meio de mídia direcionado a pacientes em contexto pré-operatório,LUCIANO ALVES MATIAS DA SILVEIRA,ICS,Projeto,Saúde,16/07/2021,17/01/2022,14/06/2021,23/06/2021,SIEX - Fluxo Contínuo,Não Tem Recurso Financeiro,----
202/2021,MESA REDONDA “BNCC e suas Implicações à Formação de Professores: da formulação às críticas e inquietudes” ,JAMES ROGADO,CAMPUS UNIVERSITÁRIO DE ITURAMA,Evento,EDUCAÇÃO,30/06/2021,14/07/2021,08/06/2021,24/06/2021,SIEX - Fluxo Contínuo,Não Tem Recurso Financeiro,----
203/2021,Cine Pet,OZIRIS BORGES FILHO,IELACHS,Projeto,Cultura,22/07/2021,09/12/2021,22/06/2021,24/06/2021,SIEX - Fluxo Contínuo,Não Tem Recurso Financeiro,----
204/2021,LIGA ACADÊMICA DE CLÍNICA MÉDICA,RODRIGO JULIANO MOLINA,ICS,Liga Acadêmica (Programa),Saúde,12/07/2021,12/07/2022,24/05/2021,24/06/2021,SIEX - Fluxo Contínuo,Não Tem Recurso Financeiro,----
205/2021,Ciclo de debates em Saúde Coletiva,ROSANE APARECIDA DE SOUSA MARTINS,IELACHS,Curso,Saúde,07/07/2021,22/12/2021,07/06/2021,25/06/2021,SIEX - Fluxo Contínuo,Não Tem Recurso Financeiro,----
206/2021,Clube do Conto ,OZIRIS BORGES FILHO,IELACHS,Projeto,Educação,20/07/2021,02/12/2021,22/06/2021,25/06/2021,SIEX - Fluxo Contínuo,Não Tem Recurso Financeiro,----
207/2021,"Distribuição espacial dos casos, óbitos e vacinação contra a COVID-19 na Macrorregião de Saúde do Triângulo do Sul, MG",RICARDO VICENTE FERREIRA,IELACHS,Projeto,Saúde,07/06/2021,06/06/2022,10/05/2021,28/06/2021,SIEX - Fluxo Contínuo,Não Tem Recurso Financeiro,----
208/2021,"SemPReBio - Seminários, Palestras e Relatos Biológicos",LUCIANA SEGURA DE ANDRADE,CAMPUS UNIVERSITÁRIO DE ITURAMA,Projeto,Educação,19/07/2021,24/12/2021,19/06/2021,30/06/2021,SIEX - Fluxo Contínuo,Não Tem Recurso Financeiro,----
209/2021,Site: Terapia Intensiva a um Clique ,HUDSON HENRIQUE GOMES PIRES,ICS,Projeto,Saúde,08/07/2021,08/07/2022,08/06/2021,02/07/2021,SIEX - Fluxo Contínuo,Não Tem Recurso Financeiro,----
210/2021,II Encontro de Botânica de Uberaba,POLYANA NORONHA SOARES,ICENE,Evento,Educação,15/07/2021,07/10/2021,30/06/2021,05/07/2021,SIEX - Fluxo Contínuo,Não Tem Recurso Financeiro,----
211/2021,Cidades e Comunidades Sustentáveis,VIVIANI ANTUNES GOMES RODRIGUES,ICTE,Projeto,Meio ambiente,29/07/2021,02/07/2022,01/07/2021,05/07/2021,SIEX - Fluxo Contínuo,Não Tem Recurso Financeiro,----
212/2021,Curso de capacitação em doença de Alzheimer,MARKUS VINICIUS CAMPOS SOUZA,ICS,Curso,Saúde,25/07/2021,18/12/2021,24/06/2021,05/07/2021,SIEX - Fluxo Contínuo,Não Tem Recurso Financeiro,----
213/2021,II Congresso Brasileiro de Educação Integral – IV Seminário Mineiro de Educação Integral,573,ICS,Evento,Educação,03/05/2021,27/08/2021,28/06/2021,06/07/2021,SIEX - Fluxo Contínuo,Não Tem Recurso Financeiro,----
214/2021,VIII Simpósio da Liga Acadêmica de Pediatria,VALERIA CARDOSO ALVES CUNALI,ICS,Evento,Saúde,02/08/2021,02/08/2021,30/06/2021,07/07/2021,SIEX - Fluxo Contínuo,Não Tem Recurso Financeiro,----
215/2021,Impactos da espiritualidade na qualidade de vida em egressas do sistema prisional de Uberaba,ADRIANA CLEMENTE MENDONCA,ICS,Projeto,Saúde,21/07/2021,23/12/2021,22/06/2021,08/07/2021,SIEX - Fluxo Contínuo,Não Tem Recurso Financeiro,----
